{
  "id": "uc-ud02",
  "title": "Building energy performance and renovation prioritisation",
  "summary": "Thermal and emissions data help cities target building renovation for maximum energy and climate benefit.",
  "description": "Buildings account for a large share of urban energy use and emissions, but cities struggle to identify which buildings to renovate first. Whole-stock thermal surveys are expensive and quickly outdated.\n\nCAMS residential-emissions data and CLMS land-cover products, combined with drone-based thermal imaging and building information, support digital twins that identify worst-performing buildings. Planners can prioritise renovation for the greatest energy and emissions benefit.",
  "status": "published",
  "maturity": "pilot",
  "classification": {
    "market_segments": [
      "transport.urban"
    ],
    "products": [
      "cams",
      "clms"
    ],
    "site": {
      "integration_mode": "Data-fusion input + processing",
      "integration_detail": "CAMS emissions and CLMS land cover are fused with drone thermal imagery, BIM and IoT data into a digital twin. Copernicus is one input among several in a multi-source workflow."
    }
  },
  "tags": [],
  "relations": [
    {
      "type": "addresses",
      "target": "need.ud02",
      "target_kind": "need"
    }
  ],
  "sources": [
    {
      "type": "derived",
      "reference": "Migrated from old usecases/*.json content model"
    }
  ],
  "history": [
    {
      "timestamp": "2026-06-25T00:00:00Z",
      "author": "migration-script",
      "comment": "Migrated from old flat use-case schema (problem/solution/services/copernicusRole)."
    }
  ]
}
