{
  "id": "uc-ud01",
  "title": "Urban heat island mapping for climate adaptation",
  "summary": "Land surface temperature and land cover data identify urban heat hotspots for targeted intervention.",
  "description": "Urban heat islands worsen health risks and energy demand during heatwaves, but city authorities often lack a spatial evidence base to identify the hottest areas and prioritise cooling interventions such as greening or reflective surfaces.\n\nCLMS land-surface-temperature and imperviousness products, combined with C3S climate data, produce composite urban heat-exposure maps. Authorities use them to target tree planting, cool-surface pilots and vulnerable-population support where heat stress is greatest.",
  "status": "published",
  "maturity": "pilot",
  "classification": {
    "market_segments": [
      "transport.urban"
    ],
    "products": [
      "clms",
      "era5"
    ],
    "site": {
      "integration_mode": "Requires further processing",
      "integration_detail": "CLMS land-surface-temperature and imperviousness products are combined with C3S data into a composite heat-exposure index. Copernicus supplies the layers; analysis builds the indicator."
    }
  },
  "tags": [],
  "relations": [
    {
      "type": "addresses",
      "target": "need.ud01",
      "target_kind": "need"
    }
  ],
  "sources": [
    {
      "type": "derived",
      "reference": "Migrated from old usecases/*.json content model"
    }
  ],
  "history": [
    {
      "timestamp": "2026-06-25T00:00:00Z",
      "author": "migration-script",
      "comment": "Migrated from old flat use-case schema (problem/solution/services/copernicusRole)."
    }
  ]
}
