{
  "id": "uc-ra03",
  "title": "HD-map validation and change detection for ADAS/AV",
  "summary": "Satellite land cover change detection targets re-survey effort for HD maps used by driver-assistance systems.",
  "description": "HD maps underpinning advanced driver-assistance and autonomous systems degrade as the roadside environment changes. Calendar-based re-survey is inefficient — surveying unchanged areas while missing significant changes that cause sensor-fusion errors.\n\nAnnual CLMS High Resolution Layers and Sentinel-2 change detection flag land-cover change along road corridors. Change alerts trigger targeted re-survey assignments, focusing mobile-mapping effort where the environment has actually changed.",
  "status": "published",
  "maturity": "pilot",
  "classification": {
    "market_segments": [
      "transport.road"
    ],
    "products": [
      "clms",
      "sentinel-2"
    ],
    "site": {
      "integration_mode": "Data-fusion input + processing",
      "integration_detail": "CLMS layers and Sentinel-2 change detection flag where to re-survey; the HD map itself is built from mobile mapping. Copernicus acts as a change-trigger within a larger mapping workflow."
    }
  },
  "tags": [],
  "relations": [
    {
      "type": "addresses",
      "target": "need.ra03",
      "target_kind": "need"
    }
  ],
  "sources": [
    {
      "type": "derived",
      "reference": "Migrated from old usecases/*.json content model"
    }
  ],
  "history": [
    {
      "timestamp": "2026-06-25T00:00:00Z",
      "author": "migration-script",
      "comment": "Migrated from old flat use-case schema (problem/solution/services/copernicusRole)."
    }
  ]
}
