{
  "id": "uc-rl03",
  "title": "Vegetation encroachment monitoring along corridors",
  "summary": "Satellite vegetation products detect canopy growth near tracks and overhead lines, targeting clearance work.",
  "description": "Vegetation growing near tracks and overhead lines causes contact incidents, signal obstruction and leaf-fall adhesion problems. Manual line-side patrols are expensive, seasonal and inconsistent, missing fast-growing species between inspection cycles.\n\nCLMS tree-cover and vegetation-phenology products derived from Sentinel-2 can detect canopy change within a corridor buffer along the network. Change alerts above a defined threshold trigger targeted clearance work orders, replacing calendar-based inspection.",
  "status": "published",
  "maturity": "operational",
  "classification": {
    "market_segments": [
      "transport.rail"
    ],
    "products": [
      "clms",
      "sentinel-2"
    ],
    "site": {
      "integration_mode": "Requires further processing",
      "integration_detail": "CLMS tree-cover and phenology products from Sentinel-2 are clipped to a corridor buffer and differenced over time to flag encroachment. Copernicus supplies the vegetation layer; change-detection processing turns it into alerts."
    }
  },
  "tags": [],
  "relations": [
    {
      "type": "addresses",
      "target": "need.rl03",
      "target_kind": "need"
    }
  ],
  "sources": [
    {
      "type": "derived",
      "reference": "Migrated from old usecases/*.json content model"
    }
  ],
  "history": [
    {
      "timestamp": "2026-06-25T00:00:00Z",
      "author": "migration-script",
      "comment": "Migrated from old flat use-case schema (problem/solution/services/copernicusRole)."
    }
  ]
}
